GO.ID,Term,Annotated,Significant,Expected,Rank in p.value_classic,p.value_elim,p.value_classic,padj_BY_elim,genes
GO:0010638,positive regulation of organelle organization,586,26,12.52,261,0.01,3.7e-4,1,"APOA1,AURKB,BNIP3,CCL26,CCL27,CCNB1,CDCA5,CSF2,EDN1,HNRNPA1,HRAS,HSPA1A,HSPA1B,IGF2,IL1B,MGARP,MSX2,NUSAP1,PHF19,PMAIP1,RAC2,S100A10,TAC1,TNF,UBE2C,UBL5"
GO:1903707,negative regulation of hemopoiesis,139,8,2.97,681,0.01005,0.01005,1,"C1QC,CCL3,HOXA9,ID2,IL2,MIR222,MYC,NFKBIA"
GO:0045124,regulation of bone resorption,40,4,0.85,685,0.01022,0.01022,1,"CA2,CALCA,IL6,SPP1"
GO:0001892,embryonic placenta development,86,6,1.84,686,0.01024,0.01024,1,"ADM,CSF2,HEY2,IGF2,JUNB,SNAI1"
GO:0045778,positive regulation of ossification,86,6,1.84,687,0.01024,0.01024,1,"FBXO5,IFITM1,IL6,MSX2,OSR2,TAC1"
GO:0045453,bone resorption,62,5,1.32,688,0.01036,0.01036,1,"CA2,CALCA,IL6,RAC2,SPP1"
GO:0032623,interleukin-2 production,62,5,1.32,689,0.01036,0.01036,1,"CD83,FCER1G,IL1B,PRNP,VSIG4"
GO:0090068,positive regulation of cell cycle process,287,21,6.13,54,0.01054,1e-6,1,"AIF1,AURKB,BTG2,CCNB1,CDCA5,CDK1,EDN1,FAM83D,FBXO5,GADD45A,ID2,IGF2,IL1B,KIF23,MAD2L1,MIR222,MSX2,NUSAP1,PLK2,RPL23,UBE2C"
GO:0032870,cellular response to hormone stimulus,677,24,14.46,692,0.01083,0.01083,1,"AIF1,AKR1C3,ANXA5,CA2,CAV1,DDIT4,DUSP1,EDN1,FOS,IGF2,IL1B,JUNB,MGARP,MSX2,NR0B2,NR4A1,PGF,RAMP2,RORB,SPP1,SST,TCF21,TRIB3,TSHB"
GO:0002683,negative regulation of immune system process,400,20,8.55,273,0.01089,4e-4,1,"APOA1,C1QC,CCL2,CCL3,CST7,DUSP1,FCER1G,HOXA9,ID2,IL2,LST1,MIR222,MMP12,MYC,NFKBIA,PRNP,TNF,TNFRSF13B,TYROBP,VSIG4"
GO:0050792,regulation of viral process,200,10,4.27,694,0.01101,0.01101,1,"CCL3,CCL4,CXCR4,IFITM1,KPNA2,LGALS1,MIR222,PTX3,TNF,TOP2A"
GO:0047497,mitochondrion transport along microtubule,22,3,0.47,695,0.01102,0.01102,1,"MGARP,UBB,UCHL1"
GO:0034643,"establishment of mitochondrion localization, microtubule-mediated",22,3,0.47,696,0.01102,0.01102,1,"MGARP,UBB,UCHL1"
GO:0061844,antimicrobial humoral immune response mediated by antimicrobial peptide,63,5,1.35,698,0.01106,0.01106,1,"CXCL1,CXCL2,CXCL3,KRT6A,RPL39"
GO:0071216,cellular response to biotic stimulus,230,14,4.91,281,0.01143,4.4e-4,1,"ANKRD1,CCL2,CCL3,CSF2,CXCL1,CXCL2,CXCL3,DDIT3,HMGB2,IL1B,IL6,NFKBIA,TNF,VIM"
GO:0071222,cellular response to lipopolysaccharide,201,13,4.29,271,0.01156,4e-4,1,"ANKRD1,CCL2,CCL3,CSF2,CXCL1,CXCL2,CXCL3,HMGB2,IL1B,IL6,NFKBIA,TNF,VIM"
GO:0001935,endothelial cell proliferation,172,9,3.67,708,0.01177,0.01177,1,"APOA1,CAV1,CCL2,CCL26,HMGB2,MIR222,NR4A1,PGF,TNF"
GO:0030278,regulation of ossification,189,14,4.04,145,0.01178,5.7e-5,1,"AREG,CCL3,FBXO5,ID2,ID3,IFITM1,IL6,MIR675,MSX2,OSR2,RORB,SRGN,TAC1,TNF"
GO:0051592,response to calcium ion,143,8,3.06,710,0.0118,0.0118,1,"AKR1C3,ANXA5,CAV1,DUSP1,EDN1,FOS,JUNB,TSHB"
GO:0050850,positive regulation of calcium-mediated signaling,42,4,0.9,713,0.0121,0.0121,1,"CCL3,CCL4,LMCD1,TNF"
GO:0043618,regulation of transcription from RNA polymerase II promoter in response to stress,116,7,2.48,715,0.01227,0.01227,1,"ATF3,BAG3,CA9,DDIT3,EGLN3,HSPA1A,UBB"
