GO.ID,Term,Annotated,Significant,Expected,Rank in p.value_classic,p.value_elim,p.value_classic,padj_BY_elim,genes
GO:0009991,response to extracellular stimulus,510,22,11.63,214,0.0191,0.00333,1,"ADA,ADM,AQP3,ASNS,ATF3,CAT,CCND1,DDIT3,GAST,GDF15,GLRX2,GSN,HAT1,ICAM1,IL1B,KLF10,NUDT1,P2RY1,PMAIP1,SPP1,TNFRSF11B,XBP1"
GO:0051092,positive regulation of NF-kappaB transcription factor activity,147,8,3.35,475,0.01958,0.01958,1,"AGT,CAT,CD40,EDA2R,ICAM1,IL1B,S100A8,TNF"
GO:0000187,activation of MAPK activity,147,8,3.35,476,0.01958,0.01958,1,"CXCL17,CXCR4,DUSP6,GDF15,IL1B,MAP2K3,SAA1,TNF"
GO:0043281,regulation of cysteine-type endopeptidase activity involved in apoptotic process,206,10,4.7,478,0.02007,0.02007,1,"BIRC5,EGLN3,GSN,IGBP1,LAMTOR5,PLAUR,PMAIP1,S100A8,TNF,TNFSF10"
GO:0048639,positive regulation of developmental growth,177,9,4.04,483,0.02046,0.02046,1,"AGR2,CRABP2,CXCR4,EDN1,FN1,FOXS1,HEY2,ILK,PPIB"
GO:0035094,response to nicotine,46,4,1.05,484,0.02047,0.02047,1,"B2M,CHRNB3,EDN1,TNF"
GO:2000107,negative regulation of leukocyte apoptotic process,46,4,1.05,485,0.02047,0.02047,1,"ADA,AURKB,FCER1G,TSC22D3"
GO:0045646,regulation of erythrocyte differentiation,46,4,1.05,486,0.02047,0.02047,1,"B2M,HMGB2,ID2,ZNF16"
GO:0010517,regulation of phospholipase activity,69,5,1.57,487,0.02053,0.02053,1,"AGT,ANXA8L1,HRAS,LPAR2,RGS2"
GO:0006614,SRP-dependent cotranslational protein targeting to membrane,94,6,2.14,488,0.02055,0.02055,1,"RPL21,RPL23,RPL39,RPS21,SEC61B,ZFAND2B"
GO:0043084,penile erection,10,2,0.23,490,0.02068,0.02068,1,"ADA,P2RY1"
GO:0051024,positive regulation of immunoglobulin secretion,10,2,0.23,491,0.02068,0.02068,1,"IL6,XBP1"
GO:0033327,Leydig cell differentiation,10,2,0.23,492,0.02068,0.02068,1,"CCND1,MGST1"
GO:0032306,regulation of prostaglandin secretion,10,2,0.23,493,0.02068,0.02068,1,"EDN1,IL1B"
GO:0032308,positive regulation of prostaglandin secretion,10,2,0.23,494,0.02068,0.02068,1,"EDN1,IL1B"
GO:0051409,response to nitrosative stress,10,2,0.23,495,0.02068,0.02068,1,"DDIT3,DUSP6"
GO:0006307,DNA dealkylation involved in DNA repair,10,2,0.23,496,0.02068,0.02068,1,"ALKBH2,ALKBH3"
GO:0006183,GTP biosynthetic process,10,2,0.23,497,0.02068,0.02068,1,"IMPDH2,NME1"
GO:0001660,fever generation,10,2,0.23,498,0.02068,0.02068,1,"IL1B,TNF"
GO:1902237,positive regulation of endoplasmic reticulum stress-induced intrinsic apoptotic signaling pathway,10,2,0.23,499,0.02068,0.02068,1,"DDIT3,PMAIP1"
GO:0036500,ATF6-mediated unfolded protein response,10,2,0.23,500,0.02068,0.02068,1,"DDIT3,XBP1"
GO:0009151,purine deoxyribonucleotide metabolic process,10,2,0.23,501,0.02068,0.02068,1,"ADA,NUDT1"
GO:0071450,cellular response to oxygen radical,26,3,0.59,502,0.02075,0.02075,1,"ADPRHL2,GLRX2,TNF"
GO:0071451,cellular response to superoxide,26,3,0.59,503,0.02075,0.02075,1,"ADPRHL2,GLRX2,TNF"
GO:0043090,amino acid import,26,3,0.59,504,0.02075,0.02075,1,"AGT,RGS2,SLC1A5"
GO:0043620,regulation of DNA-templated transcription in response to stress,121,7,2.76,505,0.02093,0.02093,1,"ATF3,BAG3,DDIT3,EGLN3,PSMC4,PSMC5,PSMC6"
