GO.ID,Term,Annotated,Significant,Expected,Rank in p.value_classic,p.value_elim,p.value_classic,padj_BY_elim,genes
GO:0060337,type I interferon signaling pathway,88,16,1.93,2,7.3e-11,7.3e-11,4.696758799923411e-6,"BST2,EGR1,IFI6,IFIT1,IFIT2,IFIT3,IFITM1,IFITM2,ISG15,MX1,MX2,OAS1,OAS2,OASL,PSMB8,RSAD2"
GO:0051607,defense response to virus,228,23,5.01,5,1.3e-9,1.3e-9,4.1820455067811195e-5,"BNIP3,BST2,DHX58,IFI6,IFIH1,IFIT1,IFIT2,IFIT3,IFITM1,IFITM2,IL1B,ISG15,MX1,MX2,OAS1,OAS2,OASL,PARP9,RSAD2,RTP4,TLR3,TRIM22,UNC93B1"
GO:0045071,negative regulation of viral genome replication,55,11,1.21,7,2.5e-8,2.5e-8,5.361596803565538e-4,"BST2,IFIT1,IFITM1,IFITM2,ISG15,MX1,OAS1,OASL,RSAD2,SLPI,TNF"
GO:0035455,response to interferon-alpha,20,6,0.44,22,3.2e-6,3.2e-6,0.045037413149950516,"BST2,IFIT2,IFIT3,IFITM1,IFITM2,MX2"
GO:0045080,positive regulation of chemokine biosynthetic process,12,5,0.26,23,3.5e-6,3.5e-6,0.045037413149950516,"CD74,EGR1,IL1B,TLR3,TNF"
GO:0046886,positive regulation of hormone biosynthetic process,11,4,0.24,39,6.7e-5,6.7e-5,0.7184539716777821,"ADM,EGR1,IL1B,TNF"
GO:0051384,response to glucocorticoid,144,11,3.16,59,3.4e-4,3.4e-4,1,"AANAT,ADM,ALPL,ANXA3,CLDN1,FOS,MDK,SPARC,STC1,TNF,TYMS"
GO:0046686,response to cadmium ion,61,7,1.34,60,3.7e-4,3.7e-4,1,"B2M,CHUK,FOS,JUN,PRNP,SLC30A1,SPARC"
GO:0032940,secretion by cell,1471,52,32.31,63,4.1e-4,4.1e-4,1,"ADM,AGPAT2,ALDOC,ANG,ANXA3,ARL2,ARL4D,B2M,BST2,CCR1,CD274,CD300A,CHUK,CLU,CPE,CTSD,CTSZ,FAM3B,FERMT3,FRK,GATA2,GLA,GRM2,HYAL3,IFIH1,IL1B,ISG15,LCN2,LGALS3,LGALS3BP,LIN7B,LRRC32,MDK,NCKAP1L,NMB,NMU,PCYOX1L,POU2F2,PRCP,RARRES2,RNASET2,RSAD2,SLC17A9,SLC30A1,SLPI,SPARC,SYBU,TIMP1,TMEM179B,TNF,VAMP1,VTCN1"
GO:0030335,positive regulation of cell migration,511,29,11.22,21,7.2e-4,3.2e-6,1,"ADAMTS1,ANXA3,CCR1,CD274,CD74,CXCR4,FAM110C,FERMT3,FGFR1OP,GATA2,GLIPR2,GPNMB,IGFBP5,IL1B,JUN,KDR,LGALS3,LGR6,LPAR1,MDK,MIR499A,NCKAP1L,PDGFRA,PTN,RARRES2,RET,SPARC,THY1,TNF"
GO:0060333,interferon-gamma-mediated signaling pathway,73,7,1.6,84,0.00109,0.00109,1,"B2M,OAS1,OAS2,OASL,PARP9,TRIM21,TRIM22"
GO:0030449,regulation of complement activation,54,6,1.19,85,0.00114,0.00114,1,"C1S,C2,CFB,CFH,CLU,IL1B"
GO:0032515,negative regulation of phosphoprotein phosphatase activity,56,6,1.23,88,0.00139,0.00139,1,"LGALS3,NCKAP1L,PPP1R14D,PPP1R15A,PTN,TNF"
GO:0016338,calcium-independent cell-cell adhesion via plasma membrane cell-adhesion molecules,23,4,0.51,89,0.00146,0.00146,1,"CLDN1,CLDN10,CLDN3,CLDN4"
GO:0046007,negative regulation of activated T cell proliferation,11,3,0.24,91,0.00152,0.00152,1,"CD274,LRRC32,PRNP"
GO:0031652,positive regulation of heat generation,11,3,0.24,92,0.00152,0.00152,1,"IL1B,NMU,TNF"
GO:2000178,negative regulation of neural precursor cell proliferation,24,4,0.53,98,0.00172,0.00172,1,"BTG2,GATA2,PTN,SPINT2"
GO:0009615,response to virus,311,30,6.83,1,0.00173,1.1e-11,1,"BNIP3,BST2,CHUK,CLU,CXCR4,DHX58,HYAL3,IFI44,IFI6,IFIH1,IFIT1,IFIT2,IFIT3,IFITM1,IFITM2,IL1B,ISG15,LCN2,MX1,MX2,OAS1,OAS2,OASL,PARP9,RSAD2,RTP4,TLR3,TNF,TRIM22,UNC93B1"
GO:0060670,branching involved in labyrinthine layer morphogenesis,12,3,0.26,104,0.002,0.002,1,"ADM,RSPO3,SPINT2"
GO:0043568,positive regulation of insulin-like growth factor receptor signaling pathway,12,3,0.26,105,0.002,0.002,1,"CDH3,IGFBP3,IGFBP5"
GO:0042368,vitamin D biosynthetic process,12,3,0.26,106,0.002,0.002,1,"CYP2R1,IL1B,TNF"
GO:0043123,positive regulation of I-kappaB kinase/NF-kappaB signaling,181,11,3.98,112,0.00224,0.00224,1,"BST2,CD74,CHUK,CX3CR1,GPRC5B,IL1B,LPAR1,SECTM1,TLR3,TNF,TRIM22"
GO:0035456,response to interferon-beta,26,4,0.57,113,0.00234,0.00234,1,"BST2,IFITM1,IFITM2,TLR3"
GO:0032147,activation of protein kinase activity,326,16,7.16,116,0.00239,0.00239,1,"ANG,AVPI1,BORA,CD300A,CD74,CXCR4,GADD45G,GPRC5B,GPRC5C,IL1B,LPAR1,NCKAP1L,PRNP,RET,TLR3,TNF"
GO:1900272,negative regulation of long-term synaptic potentiation,13,3,0.29,122,0.00255,0.00255,1,"CX3CR1,PRNP,PTN"
GO:1902430,negative regulation of amyloid-beta formation,13,3,0.29,123,0.00255,0.00255,1,"CLU,PRNP,SPON1"
GO:0046683,response to organophosphorus,132,9,2.9,125,0.00256,0.00256,1,"AANAT,FOS,IGFBP5,IL1B,JUN,LPAR1,SPARC,STC1,TYMS"
GO:0071675,regulation of mononuclear cell migration,44,5,0.97,128,0.00267,0.00267,1,"CCR1,LGALS3,MDK,RARRES2,TNF"
GO:0001516,prostaglandin biosynthetic process,27,4,0.59,129,0.00269,0.00269,1,"CD74,IL1B,PTGDS,PTGES"
GO:0008608,attachment of spindle microtubules to kinetochore,28,4,0.62,138,0.00309,0.00309,1,"CCNB1,KNSTRN,MIS12,NDC80"
GO:0006000,fructose metabolic process,14,3,0.31,142,0.0032,0.0032,1,"ALDH1A1,ALDOC,KHK"
GO:0045646,regulation of erythrocyte differentiation,46,5,1.01,143,0.00326,0.00326,1,"B2M,GATA2,ISG15,MAFB,NCKAP1L"
GO:0014911,positive regulation of smooth muscle cell migration,46,5,1.01,144,0.00326,0.00326,1,"ADAMTS1,IGFBP5,LPAR1,MDK,MIR499A"
GO:0046596,regulation of viral entry into host cell,29,4,0.64,149,0.00352,0.00352,1,"CD74,IFITM1,IFITM2,TRIM21"
GO:0045766,positive regulation of angiogenesis,194,11,4.26,151,0.00382,0.00382,1,"ADM,ANGPTL4,ANXA3,CX3CR1,CXCR4,GATA2,IL1B,KDR,MDK,STIM1,TLR3"
GO:0043086,negative regulation of catalytic activity,772,33,16.96,51,0.00383,2.1e-4,1,"ANGPTL4,ANXA3,ARL2,BST2,CD300A,CDKN1C,CPEB2,DHCR24,FGFR1OP,GCHFR,GLA,GNAQ,GPR87,GRM2,HEXIM2,IFI6,IFIT1,IL1B,LGALS3,NCKAP1L,PARP9,PCSK1N,PPP1R14D,PPP1R15A,PRNP,PTN,SLPI,SPINK13,SPINT2,THY1,TIMP1,TNF,WFDC2"
GO:0019883,antigen processing and presentation of endogenous antigen,15,3,0.33,153,0.00393,0.00393,1,"B2M,CD74,TAP1"
GO:0060099,"regulation of phagocytosis, engulfment",15,3,0.33,154,0.00393,0.00393,1,"CD300A,GATA2,NCKAP1L"
GO:0045410,positive regulation of interleukin-6 biosynthetic process,15,3,0.33,155,0.00393,0.00393,1,"CD74,IL1B,TNF"
GO:0071360,cellular response to exogenous dsRNA,15,3,0.33,156,0.00393,0.00393,1,"IFIH1,IFIT1,TLR3"
GO:0007159,leukocyte cell-cell adhesion,326,18,7.16,58,0.00399,3.3e-4,1,"CCL28,CD274,CD300A,CD74,CX3CR1,FERMT3,GPNMB,IL1B,IL1RL2,LGALS3,LRRC32,MDK,NCKAP1L,NT5E,PRNP,THY1,TNF,VTCN1"
GO:0000266,mitochondrial fission,30,4,0.66,157,0.004,0.004,1,"BNIP3,KDR,MX1,MX2"
GO:1904707,positive regulation of vascular smooth muscle cell proliferation,49,5,1.08,163,0.0043,0.0043,1,"ADAMTS1,IGFBP5,JUN,MIR499A,TNF"
GO:0048709,oligodendrocyte differentiation,93,7,2.04,166,0.00438,0.00438,1,"BNIP3,CLU,CXCR4,GPR17,LPAR1,MDK,PTN"
GO:0016486,peptide hormone processing,31,4,0.68,169,0.00451,0.00451,1,"CPE,CTSZ,PCSK1,PCSK1N"
GO:0010811,positive regulation of cell-substrate adhesion,118,8,2.59,172,0.00452,0.00452,1,"ARL2,CCDC80,CCL28,KDR,MDK,PTN,S100A10,THY1"
GO:1901216,positive regulation of neuron death,94,7,2.06,175,0.00465,0.00465,1,"CLU,CTSZ,EGR1,FOS,JUN,PRNP,TNF"
GO:0014015,positive regulation of gliogenesis,71,6,1.56,176,0.00465,0.00465,1,"CLCF1,CXCR4,IL1B,MDK,PTN,TNF"
GO:0048146,positive regulation of fibroblast proliferation,50,5,1.1,177,0.00469,0.00469,1,"CCNA2,CCNB1,CD74,JUN,PDGFRA"
GO:0034116,positive regulation of heterotypic cell-cell adhesion,16,3,0.35,179,0.00476,0.00476,1,"IL1B,THY1,TNF"
GO:0044849,estrous cycle,16,3,0.35,180,0.00476,0.00476,1,"EGR1,MDK,PTN"
GO:0072224,metanephric glomerulus development,16,3,0.35,181,0.00476,0.00476,1,"EGR1,PDGFRA,RET"
GO:0071456,cellular response to hypoxia,200,11,4.39,184,0.0048,0.0048,1,"BNIP3,CA9,CCNA2,CCNB1,CPEB2,EGR1,MALAT1,PSMB8,PSMB9,PTN,STC1"
GO:0007229,integrin-mediated signaling pathway,97,7,2.13,194,0.00552,0.00552,1,"ADAMTS1,FERMT3,ISG15,ITGA9,PTN,THY1,TIMP1"
GO:0060046,regulation of acrosome reaction,17,3,0.37,196,0.00569,0.00569,1,"CCDC87,HYAL3,SPINK13"
GO:0006955,immune response,1855,80,40.75,6,0.00576,1.9e-9,1,"AGPAT2,ALDOC,ANXA3,ARID5A,B2M,BST2,C1S,C2,CCL28,CCR1,CD274,CD300A,CD74,CDC42EP2,CFB,CFH,CHUK,CLCF1,CLDN1,CLU,CTSD,CTSZ,CX3CR1,CXCR4,CYSLTR1,DHX58,EGR1,FOS,FRK,GATA2,GLA,GPR17,GPRC5B,HCST,IFI44,IFI6,IFIH1,IFIT1,IFIT2,IFIT3,IFITM1,IFITM2,IL18BP,IL1B,IL1RL2,ISG15,JUN,KLK5,LCN2,LGALS3,MDK,MUC1,MX1,MX2,NCKAP1L,OAS1,OAS2,OASL,PARP9,PLD2,POU2F2,PRCP,PRNP,PSMB8,PSMB9,RARRES2,RNASET2,RSAD2,SECTM1,SLPI,SMPDL3B,TAP1,THY1,TLR3,TMEM179B,TNF,TRIM21,TRIM22,UNC93B1,VTCN1"
GO:0006809,nitric oxide biosynthetic process,76,6,1.67,201,0.00648,0.00648,1,"CLU,CX3CR1,GCHFR,GLA,IL1B,TNF"
GO:0001101,response to acid chemical,330,15,7.25,202,0.0065,0.0065,1,"AANAT,CCNB1,CHUK,CLDN1,EGR1,FOLR1,GJB3,KDR,PDGFRA,PTGES,PTN,RET,SPARC,TNF,TYMS"
GO:0002763,positive regulation of myeloid leukocyte differentiation,54,5,1.19,203,0.00652,0.00652,1,"CCR1,CD74,FOS,JUN,TNF"
GO:0002922,positive regulation of humoral immune response,18,3,0.4,205,0.00671,0.00671,1,"IL1B,KLK5,TNF"
GO:0007252,I-kappaB phosphorylation,18,3,0.4,206,0.00671,0.00671,1,"CHUK,CX3CR1,TLR3"
GO:0006952,defense response,1528,67,33.56,8,0.00696,2.8e-8,1,"ADM,ANXA3,ARID5A,B2M,BNIP3,BST2,C1S,C2,CCR1,CD74,CDC42EP2,CFB,CFH,CHUK,CLDN1,CLU,CX3CR1,CXCR4,CYSLTR1,DHX58,EGR1,FOS,GPR17,GPRC5B,HYAL3,IFI6,IFIH1,IFIT1,IFIT2,IFIT3,IFITM1,IFITM2,IL1B,IL1RL2,ISG15,JUN,KLK5,LCN2,LGALS3,LGALS3BP,MDK,MUC1,MX1,MX2,NT5E,OAS1,OAS2,OASL,PARP9,PBK,PRCP,PSMB8,PSMB9,PTGES,PTN,RARRES2,RSAD2,RTP4,SLPI,SMPDL3B,TAP1,TIMP1,TLR3,TNF,TRIM21,TRIM22,UNC93B1"
GO:0061900,glial cell activation,55,5,1.21,211,0.00704,0.00704,1,"CLU,IL1B,JUN,TLR3,TNF"
GO:0002237,response to molecule of bacterial origin,335,15,7.36,215,0.00742,0.00742,1,"ADM,ALPL,B2M,CD274,CHUK,CLDN1,CX3CR1,FOS,IL1B,JUN,LCN2,PTGES,SLPI,SPARC,TNF"
GO:0001836,release of cytochrome c from mitochondria,56,5,1.23,216,0.0076,0.0076,1,"BIK,BNIP3,CLU,IFI6,JUN"
GO:0060760,positive regulation of response to cytokine stimulus,56,5,1.23,217,0.0076,0.0076,1,"AGPAT2,CD74,CXCR4,IFIH1,PARP9"
GO:0002726,positive regulation of T cell cytokine production,19,3,0.42,218,0.00784,0.00784,1,"B2M,IL1B,RSAD2"
GO:1902993,positive regulation of amyloid precursor protein catabolic process,19,3,0.42,219,0.00784,0.00784,1,"CLU,SPON1,TNF"
GO:0042908,xenobiotic transport,19,3,0.42,220,0.00784,0.00784,1,"CLDN1,PDZK1,SLC6A6"
GO:0071459,"protein localization to chromosome, centromeric region",19,3,0.42,221,0.00784,0.00784,1,"CTCF,MIS12,NDC80"
GO:0007204,positive regulation of cytosolic calcium ion concentration,307,14,6.74,225,0.00818,0.00818,1,"ADM,CCL28,CCR1,CX3CR1,CXCR4,CYSLTR1,GATA2,GPR17,LPAR1,NMB,NMU,PDGFRA,PRNP,THY1"
GO:0031102,neuron projection regeneration,58,5,1.27,232,0.0088,0.0088,1,"ADM,FOLR1,JUN,PTN,THY1"
GO:0001938,positive regulation of endothelial cell proliferation,106,7,2.33,234,0.00887,0.00887,1,"ANG,EGFL7,GATA2,JUN,KDR,MDK,MIR499A"
GO:0032516,positive regulation of phosphoprotein phosphatase activity,20,3,0.44,235,0.00908,0.00908,1,"CD300A,PPP1R14D,PPP1R15A"
GO:0050860,negative regulation of T cell receptor signaling pathway,20,3,0.44,236,0.00908,0.00908,1,"LGALS3,PRNP,THY1"
GO:0051797,regulation of hair follicle development,20,3,0.44,237,0.00908,0.00908,1,"CDH3,FST,TNF"
GO:0032609,interferon-gamma production,107,7,2.35,242,0.00931,0.00931,1,"CD274,IL1B,ISG15,PRNP,TLR3,TNF,VTCN1"
GO:0045123,cellular extravasation,59,5,1.3,245,0.00944,0.00944,1,"CCL28,CX3CR1,MDK,THY1,TNF"
GO:0022408,negative regulation of cell-cell adhesion,174,12,3.82,69,0.00957,4.7e-4,1,"CCL28,CD274,CD300A,CD74,CDSN,GPNMB,LGALS3,LRRC32,MDK,PRNP,SPINT2,VTCN1"
GO:0016064,immunoglobulin mediated immune response,108,7,2.37,246,0.00978,0.00978,1,"C1S,C2,CD74,CLCF1,CLU,POU2F2,TNF"
GO:0002690,positive regulation of leukocyte chemotaxis,83,6,1.82,249,0.00986,0.00986,1,"CCR1,CD74,MDK,NCKAP1L,PTN,RARRES2"
GO:0097530,granulocyte migration,135,8,2.97,251,0.00995,0.00995,1,"CD300A,CD74,IL1B,ITGA9,LGALS3,MDK,NCKAP1L,RARRES2"
GO:0001818,negative regulation of cytokine production,283,13,6.22,253,0.01003,0.01003,1,"BST2,CD274,CDH3,CX3CR1,DHX58,GPNMB,IFIH1,ISG15,LRRC32,NCKAP1L,PRNP,TNF,UBE2L6"
GO:2000146,negative regulation of cell motility,315,14,6.92,254,0.01012,0.01012,1,"BST2,CCL28,CD300A,CD74,CX3CR1,IFITM1,IGFBP3,IGFBP5,PTN,SPINT2,STC1,TACSTD2,THY1,TIMP1"
GO:0045446,endothelial cell differentiation,109,7,2.39,256,0.01026,0.01026,1,"CLDN1,CXCR4,IL1B,KDR,PTN,STC1,TNF"
GO:0090279,regulation of calcium ion import,39,4,0.86,257,0.01028,0.01028,1,"LGALS3,PRNP,SLC30A1,STC1"
GO:0006887,exocytosis,873,30,19.18,258,0.01036,0.01036,1,"AGPAT2,ALDOC,ANXA3,B2M,BST2,CCR1,CD300A,CLU,CTSD,CTSZ,FERMT3,FRK,GATA2,GLA,HYAL3,LCN2,LGALS3,LGALS3BP,LIN7B,NCKAP1L,PCYOX1L,PRCP,RARRES2,RNASET2,SLC17A9,SLPI,SPARC,TIMP1,TMEM179B,VAMP1"
GO:0010893,positive regulation of steroid biosynthetic process,21,3,0.46,260,0.01042,0.01042,1,"ADM,IL1B,TNF"
GO:0042493,response to drug,1022,34,22.45,261,0.01043,0.01043,1,"AGPAT2,B2M,BNIP3,CA9,CCNA2,CCNB1,CDH3,CHUK,CLDN1,CLDN3,CLDN4,CXCR4,CYP2R1,CYP4B1,EGR1,FOLR1,FOS,GNAQ,IL1B,JUN,KDR,LCN2,MDK,NCKAP1L,PRNP,PTN,RET,RGS10,S100A10,SLC7A3,SPARC,TLR3,TNF,TYMS"
GO:0002718,regulation of cytokine production involved in immune response,80,8,1.76,61,0.01053,3.7e-4,1,"B2M,BST2,CD74,GPRC5B,IL1B,RSAD2,TLR3,TNF"
GO:0002700,regulation of production of molecular mediator of immune response,130,10,2.86,71,0.01087,6e-4,1,"B2M,BST2,CD74,CLCF1,GPRC5B,IL1B,KLK5,RSAD2,TLR3,TNF"
GO:0045687,positive regulation of glial cell differentiation,40,4,0.88,267,0.01123,0.01123,1,"CLCF1,CXCR4,MDK,PTN"
GO:0045055,regulated exocytosis,771,27,16.94,268,0.01167,0.01167,1,"AGPAT2,ALDOC,ANXA3,B2M,BST2,CD300A,CLU,CTSD,CTSZ,FERMT3,FRK,GATA2,GLA,HYAL3,LCN2,LGALS3,LGALS3BP,NCKAP1L,PCYOX1L,PRCP,RARRES2,RNASET2,SLPI,SPARC,TIMP1,TMEM179B,VAMP1"
GO:1905477,positive regulation of protein localization to membrane,112,7,2.46,269,0.0118,0.0118,1,"ARHGEF16,LGALS3,PDZK1,PRNP,PTN,TNF,YWHAH"
GO:0032727,positive regulation of interferon-alpha production,22,3,0.48,271,0.01188,0.01188,1,"CHUK,IFIH1,TLR3"
GO:0090023,positive regulation of neutrophil chemotaxis,22,3,0.48,272,0.01188,0.01188,1,"CD74,MDK,NCKAP1L"
GO:0051043,regulation of membrane protein ectodomain proteolysis,22,3,0.48,273,0.01188,0.01188,1,"IL1B,TIMP1,TNF"
GO:0032069,regulation of nuclease activity,22,3,0.48,274,0.01188,0.01188,1,"OAS1,OAS2,OASL"
GO:0061436,establishment of skin barrier,22,3,0.48,275,0.01188,0.01188,1,"CLDN1,CLDN4,FLG"
GO:0048714,positive regulation of oligodendrocyte differentiation,22,3,0.48,276,0.01188,0.01188,1,"CXCR4,MDK,PTN"
GO:1903038,negative regulation of leukocyte cell-cell adhesion,124,10,2.72,62,0.01188,4.1e-4,1,"CCL28,CD274,CD300A,CD74,GPNMB,LGALS3,LRRC32,MDK,PRNP,VTCN1"
GO:0002274,myeloid leukocyte activation,629,23,13.82,280,0.01205,0.01205,1,"AGPAT2,ALDOC,ANXA3,B2M,BST2,CD300A,CD74,CLU,CTSD,CTSZ,FRK,GATA2,GLA,JUN,LCN2,LGALS3,NCKAP1L,PRCP,RNASET2,SLPI,TLR3,TMEM179B,TNF"
GO:0071622,regulation of granulocyte chemotaxis,41,4,0.9,281,0.01223,0.01223,1,"CD74,MDK,NCKAP1L,RARRES2"
GO:0045670,regulation of osteoclast differentiation,63,5,1.38,283,0.01235,0.01235,1,"CCR1,FOS,MAFB,TLR3,TNF"
GO:0032496,response to lipopolysaccharide,323,14,7.1,284,0.0124,0.0124,1,"ADM,ALPL,CD274,CHUK,CLDN1,CX3CR1,FOS,IL1B,JUN,LCN2,PTGES,SLPI,SPARC,TNF"
GO:0060326,cell chemotaxis,287,16,6.3,73,0.01388,6.4e-4,1,"ARHGEF16,CCL28,CCR1,CD74,CX3CR1,CXCR4,IL1B,ITGA9,KDR,LGALS3,LPAR1,MDK,NCKAP1L,PDGFRA,PTN,RARRES2"
GO:0045428,regulation of nitric oxide biosynthetic process,65,5,1.43,299,0.01401,0.01401,1,"CLU,CX3CR1,GLA,IL1B,TNF"
GO:0000070,mitotic sister chromatid segregation,144,8,3.16,302,0.01429,0.01429,1,"BUB1,CCNB1,DLGAP5,KIFC1,KNSTRN,MIS12,NDC80,PRC1"
GO:0010863,positive regulation of phospholipase C activity,43,4,0.94,303,0.0144,0.0144,1,"ANG,GNAQ,LPAR1,PDGFRA"
GO:0007080,mitotic metaphase plate congression,43,4,0.94,304,0.0144,0.0144,1,"CCNB1,KIFC1,MIS12,NDC80"
GO:0032570,response to progesterone,43,4,0.94,305,0.0144,0.0144,1,"CLDN4,FOS,PTN,TYMS"
GO:0032480,negative regulation of type I interferon production,43,4,0.94,306,0.0144,0.0144,1,"DHX58,IFIH1,ISG15,UBE2L6"
GO:0071621,granulocyte chemotaxis,117,7,2.57,309,0.01473,0.01473,1,"CD74,IL1B,ITGA9,LGALS3,MDK,NCKAP1L,RARRES2"
GO:0009612,response to mechanical stimulus,204,10,4.48,313,0.01494,0.01494,1,"BNIP3,BTG2,CCNB1,CXCR4,FOS,IL1B,JUN,MDK,PTN,TLR3"
GO:0071677,positive regulation of mononuclear cell migration,24,3,0.53,314,0.01511,0.01511,1,"CCR1,LGALS3,TNF"
GO:0071624,positive regulation of granulocyte chemotaxis,24,3,0.53,315,0.01511,0.01511,1,"CD74,MDK,NCKAP1L"
GO:0061756,leukocyte adhesion to vascular endothelial cell,44,4,0.97,318,0.01558,0.01558,1,"CCL28,CX3CR1,MDK,TNF"
GO:0030336,negative regulation of cell migration,300,13,6.59,321,0.01566,0.01566,1,"BST2,CCL28,CD300A,CD74,CX3CR1,IFITM1,IGFBP3,IGFBP5,PTN,STC1,TACSTD2,THY1,TIMP1"
GO:0033273,response to vitamin,92,6,2.02,324,0.01582,0.01582,1,"ALPL,FOLR1,PTN,SPARC,STC1,TYMS"
GO:0002697,regulation of immune effector process,378,21,8.3,41,0.01629,1e-4,1,"B2M,BST2,C1S,C2,CD300A,CD74,CFB,CFH,CLCF1,CLU,DHX58,GATA2,GPRC5B,IFIT1,IL1B,KLK5,LGALS3,PARP9,RSAD2,TLR3,TNF"
GO:0000819,sister chromatid segregation,177,9,3.89,329,0.01647,0.01647,1,"BUB1,CCNB1,CTCF,DLGAP5,KIFC1,KNSTRN,MIS12,NDC80,PRC1"
GO:0032479,regulation of type I interferon production,120,7,2.64,333,0.01673,0.01673,1,"CHUK,DHX58,IFIH1,ISG15,TLR3,TRIM21,UBE2L6"
GO:0002479,"antigen processing and presentation of exogenous peptide antigen via MHC class I, TAP-dependent",68,5,1.49,335,0.01677,0.01677,1,"B2M,CHUK,PSMB8,PSMB9,TAP1"
GO:0001774,microglial cell activation,45,4,0.99,337,0.01681,0.01681,1,"CLU,JUN,TLR3,TNF"
GO:0002269,leukocyte activation involved in inflammatory response,45,4,0.99,338,0.01681,0.01681,1,"CLU,JUN,TLR3,TNF"
GO:0033628,regulation of cell adhesion mediated by integrin,45,4,0.99,339,0.01681,0.01681,1,"FERMT3,MUC1,NCKAP1L,RET"
GO:1900274,regulation of phospholipase C activity,45,4,0.99,340,0.01681,0.01681,1,"ANG,GNAQ,LPAR1,PDGFRA"
GO:0050901,leukocyte tethering or rolling,25,3,0.55,343,0.0169,0.0169,1,"CCL28,CX3CR1,TNF"
GO:0033561,regulation of water loss via skin,25,3,0.55,344,0.0169,0.0169,1,"CLDN1,CLDN4,FLG"
GO:0030325,adrenal gland development,25,3,0.55,345,0.0169,0.0169,1,"CDKN1C,MDK,PDGFRA"
GO:0045672,positive regulation of osteoclast differentiation,25,3,0.55,346,0.0169,0.0169,1,"CCR1,FOS,TNF"
GO:0051894,positive regulation of focal adhesion assembly,25,3,0.55,347,0.0169,0.0169,1,"KDR,S100A10,THY1"
GO:0050766,positive regulation of phagocytosis,69,5,1.52,352,0.01777,0.01777,1,"C2,GATA2,IL1B,NCKAP1L,TNF"
GO:2001239,regulation of extrinsic apoptotic signaling pathway in absence of ligand,46,4,1.01,355,0.0181,0.0181,1,"IFI6,IL1B,RET,TNF"
GO:1904036,negative regulation of epithelial cell apoptotic process,46,4,1.01,356,0.0181,0.0181,1,"ANGPTL4,GATA2,KDR,MDK"
GO:0002455,humoral immune response mediated by circulating immunoglobulin,46,4,1.01,357,0.0181,0.0181,1,"C1S,C2,CLU,TNF"
GO:0007622,rhythmic behavior,46,4,1.01,358,0.0181,0.0181,1,"EGR1,EGR2,NMU,PTGDS"
GO:0032606,type I interferon production,122,7,2.68,360,0.01816,0.01816,1,"CHUK,DHX58,IFIH1,ISG15,TLR3,TRIM21,UBE2L6"
GO:0051591,response to cAMP,95,6,2.09,361,0.01827,0.01827,1,"AANAT,FOS,IGFBP5,JUN,SPARC,STC1"
GO:0032649,regulation of interferon-gamma production,95,6,2.09,362,0.01827,0.01827,1,"CD274,IL1B,ISG15,PRNP,TLR3,TNF"
GO:0009636,response to toxic substance,511,19,11.22,363,0.0183,0.0183,1,"B2M,BNIP3,CCNB1,CHUK,CLDN1,CLDN3,EGR1,FOS,JUN,KDR,LCN2,PDZK1,PON3,RGS10,SLC30A1,SLC7A8,SPARC,TNF,TYMS"
GO:0050868,negative regulation of T cell activation,107,9,2.35,70,0.01851,5.8e-4,1,"CD274,CD300A,CD74,GPNMB,LGALS3,LRRC32,MDK,PRNP,VTCN1"
GO:1904754,positive regulation of vascular associated smooth muscle cell migration,26,3,0.57,365,0.0188,0.0188,1,"ADAMTS1,IGFBP5,MIR499A"
GO:0150117,positive regulation of cell-substrate junction organization,26,3,0.57,366,0.0188,0.0188,1,"KDR,S100A10,THY1"
GO:0043901,negative regulation of multi-organism process,26,3,0.57,367,0.0188,0.0188,1,"BST2,SPINK13,TIMP1"
GO:0051303,establishment of chromosome localization,70,5,1.54,369,0.0188,0.0188,1,"CCNB1,DLGAP5,KIFC1,MIS12,NDC80"
GO:0051593,response to folic acid,10,2,0.22,373,0.01927,0.01927,1,"FOLR1,TYMS"
GO:0071670,smooth muscle cell chemotaxis,10,2,0.22,374,0.01927,0.01927,1,"LPAR1,MDK"
GO:0001660,fever generation,10,2,0.22,375,0.01927,0.01927,1,"IL1B,TNF"
GO:0072641,type I interferon secretion,10,2,0.22,376,0.01927,0.01927,1,"CHUK,IFIH1"
GO:0035457,cellular response to interferon-alpha,10,2,0.22,377,0.01927,0.01927,1,"IFIT2,IFIT3"
GO:2001214,positive regulation of vasculogenesis,10,2,0.22,378,0.01927,0.01927,1,"ADM,KDR"
GO:0045657,positive regulation of monocyte differentiation,10,2,0.22,379,0.01927,0.01927,1,"CD74,JUN"
GO:0071281,cellular response to iron ion,10,2,0.22,380,0.01927,0.01927,1,"B2M,CCNB1"
GO:0098586,cellular response to virus,47,4,1.03,381,0.01945,0.01945,1,"CHUK,DHX58,IFI6,IFIH1"
GO:0002576,platelet degranulation,124,7,2.72,383,0.01967,0.01967,1,"CLU,FERMT3,LGALS3BP,PCYOX1L,RARRES2,SPARC,TIMP1"
GO:0050000,chromosome localization,71,5,1.56,385,0.01987,0.01987,1,"CCNB1,DLGAP5,KIFC1,MIS12,NDC80"
GO:0038034,signal transduction in absence of ligand,71,5,1.56,386,0.01987,0.01987,1,"IFI6,IL1B,LCN2,RET,TNF"
GO:0097192,extrinsic apoptotic signaling pathway in absence of ligand,71,5,1.56,387,0.01987,0.01987,1,"IFI6,IL1B,LCN2,RET,TNF"
GO:0043067,regulation of programmed cell death,1542,46,33.87,388,0.02019,0.02019,1,"ADM,ANGPTL4,ARHGEF16,BIK,BNIP3,BTG2,CD274,CD74,CDSN,CLCF1,CLU,CTSD,CTSZ,CX3CR1,CXCR4,DHCR24,EGR1,GADD45G,GATA2,IFI6,IFIT2,IFIT3,IGFBP3,IL1B,JUN,KDR,LGALS3,LPAR1,MAL,MDK,MTRNR2L2,MTRNR2L8,MUC1,NCKAP1L,PHLPP1,PRAME,PRNP,PTN,RET,RNF183,TIMP1,TLR3,TNF,TNFRSF12A,VTCN1,YWHAH"
GO:0045087,innate immune response,796,42,17.49,13,0.0206,1.3e-7,1,"ARID5A,B2M,BST2,C1S,C2,CDC42EP2,CFB,CFH,CHUK,CLDN1,CLU,CX3CR1,DHX58,EGR1,IFI6,IFIH1,IFIT1,IFIT2,IFIT3,IFITM1,IFITM2,IL1RL2,ISG15,LCN2,LGALS3,MUC1,MX1,MX2,OAS1,OAS2,OASL,PARP9,PSMB8,PSMB9,RARRES2,RSAD2,SLPI,SMPDL3B,TLR3,TRIM21,TRIM22,UNC93B1"
GO:1902624,positive regulation of neutrophil migration,27,3,0.59,393,0.02081,0.02081,1,"CD74,MDK,NCKAP1L"
GO:0002691,regulation of cellular extravasation,27,3,0.59,394,0.02081,0.02081,1,"CCL28,MDK,THY1"
GO:0045761,regulation of adenylate cyclase activity,27,3,0.59,395,0.02081,0.02081,1,"GPR87,GRM2,STIM1"
GO:1902230,negative regulation of intrinsic apoptotic signaling pathway in response to DNA damage,27,3,0.59,396,0.02081,0.02081,1,"CD74,CLU,MUC1"
GO:0051983,regulation of chromosome segregation,98,6,2.15,400,0.02096,0.02096,1,"BUB1,CCNB1,CTCF,DLGAP5,KNSTRN,NDC80"
GO:0042590,antigen processing and presentation of exogenous peptide antigen via MHC class I,72,5,1.58,401,0.02098,0.02098,1,"B2M,CHUK,PSMB8,PSMB9,TAP1"
GO:0031100,animal organ regeneration,72,5,1.58,402,0.02098,0.02098,1,"ADM,ANXA3,CCNA2,CLDN1,TYMS"
GO:0051241,negative regulation of multicellular organismal process,1231,38,27.04,404,0.02101,0.02101,1,"ADM,ALDH1A1,B2M,BST2,CCR1,CD274,CD74,CDH3,CDSN,CTSZ,CX3CR1,DHX58,FUOM,GATA2,GPNMB,HYAL3,IFIH1,IGFBP5,IL1B,ISG15,LPAR1,LRRC32,MAFB,MDK,NCKAP1L,NMU,PDGFRA,PRNP,PTN,SPARC,STC1,TACSTD2,THY1,TIMP1,TLR3,TNF,UBE2L6,YWHAH"
GO:1903037,regulation of leukocyte cell-cell adhesion,293,15,6.44,110,0.02129,0.00216,1,"CCL28,CD274,CD300A,CD74,GPNMB,IL1B,IL1RL2,LGALS3,LRRC32,MDK,NCKAP1L,PRNP,THY1,TNF,VTCN1"
GO:0044706,multi-multicellular organism process,216,10,4.74,405,0.02135,0.02135,1,"ADM,CLDN4,FOS,HYAL3,IGFBP5,IL1B,PNOC,PTN,STC1,TIMP1"
GO:0040013,negative regulation of locomotion,347,14,7.62,407,0.02166,0.02166,1,"BST2,CCL28,CD300A,CD74,CX3CR1,IFITM1,IGFBP3,IGFBP5,PTN,SPINT2,STC1,TACSTD2,THY1,TIMP1"
GO:0050890,cognition,281,12,6.17,409,0.02188,0.02188,1,"ARC,B2M,BTG2,CX3CR1,EGR2,FOS,JUN,MDK,METTL23,PRNP,PTN,TNF"
GO:0048878,chemical homeostasis,1138,41,25,86,0.02197,0.00122,1,"ADM,ALAS2,ANGPTL4,B2M,BNIP3,CA12,CCL28,CCR1,CLDN1,CLDN4,CX3CR1,CXCR4,CYSLTR1,FAM3B,FLG,GATA2,GPR17,GRM2,HEPH,IFI6,IFIT1,IGFBP5,KDR,LCN2,LPAR1,NMB,NMU,OAS1,PDGFRA,PRCP,PRNP,SLC24A3,SLC25A28,SLC30A1,SLC34A2,SLC7A8,STC1,STIM1,SYBU,THY1,TMEM97"
GO:0003158,endothelium development,127,7,2.79,411,0.0221,0.0221,1,"CLDN1,CXCR4,IL1B,KDR,PTN,STC1,TNF"
GO:0055076,transition metal ion homeostasis,127,7,2.79,412,0.0221,0.0221,1,"ALAS2,B2M,HEPH,LCN2,PRNP,SLC25A28,SLC30A1"
GO:0032757,positive regulation of interleukin-8 production,49,4,1.08,414,0.02233,0.02233,1,"CD74,IL1B,TLR3,TNF"
GO:0001961,positive regulation of cytokine-mediated signaling pathway,49,4,1.08,415,0.02233,0.02233,1,"AGPAT2,CD74,CXCR4,PARP9"
GO:1905517,macrophage migration,49,4,1.08,416,0.02233,0.02233,1,"CX3CR1,LGALS3,MDK,RARRES2"
GO:0007565,female pregnancy,187,9,4.11,418,0.02264,0.02264,1,"ADM,CLDN4,FOS,IGFBP5,IL1B,PNOC,PTN,STC1,TIMP1"
GO:0030593,neutrophil chemotaxis,100,6,2.2,419,0.0229,0.0229,1,"CD74,IL1B,ITGA9,LGALS3,MDK,NCKAP1L"
GO:0070498,interleukin-1-mediated signaling pathway,100,6,2.2,420,0.0229,0.0229,1,"CHUK,EGR1,IL1B,IL1RL2,PSMB8,PSMB9"
GO:0090022,regulation of neutrophil chemotaxis,28,3,0.62,422,0.02294,0.02294,1,"CD74,MDK,NCKAP1L"
GO:0032647,regulation of interferon-alpha production,28,3,0.62,423,0.02294,0.02294,1,"CHUK,IFIH1,TLR3"
GO:1904994,regulation of leukocyte adhesion to vascular endothelial cell,28,3,0.62,424,0.02294,0.02294,1,"CCL28,MDK,TNF"
GO:0051271,negative regulation of cellular component movement,350,14,7.69,427,0.02311,0.02311,1,"BST2,CCL28,CD300A,CD74,CX3CR1,IFITM1,IGFBP3,IGFBP5,PTN,SPINT2,STC1,TACSTD2,THY1,TIMP1"
GO:0070673,response to interleukin-18,11,2,0.24,428,0.02322,0.02322,1,"CLDN1,IL18BP"
GO:0002730,regulation of dendritic cell cytokine production,11,2,0.24,429,0.02322,0.02322,1,"BST2,TLR3"
GO:0009629,response to gravity,11,2,0.24,430,0.02322,0.02322,1,"FOS,SPARC"
GO:0072608,interleukin-10 secretion,11,2,0.24,431,0.02322,0.02322,1,"CD274,ISG15"
GO:0090193,positive regulation of glomerulus development,11,2,0.24,432,0.02322,0.02322,1,"EGR1,RET"
GO:0000185,activation of MAPKKK activity,11,2,0.24,433,0.02322,0.02322,1,"GADD45G,TNF"
GO:0090141,positive regulation of mitochondrial fission,11,2,0.24,434,0.02322,0.02322,1,"BNIP3,KDR"
GO:0090148,membrane fission,11,2,0.24,435,0.02322,0.02322,1,"MX1,MX2"
GO:0019371,cyclooxygenase pathway,11,2,0.24,436,0.02322,0.02322,1,"PTGDS,PTGES"
GO:0046501,protoporphyrinogen IX metabolic process,11,2,0.24,437,0.02322,0.02322,1,"ALAS2,UROS"
