GO.ID,Term,Annotated,Significant,Expected,Rank in p.value_classic,p.value_elim,p.value_classic,padj_BY_elim,genes
GO:0051607,defense response to virus,228,23,5.12,8,1.9e-9,1.9e-9,8.042395205348306e-5,"APOBEC3B,APOBEC3C,CXCL10,IFI16,IFI27,IFI44L,IFI6,IFIT1,IFIT2,IFITM1,IFITM3,IFNL1,IRF9,ISG15,MX1,MX2,OAS1,OAS2,OASL,RTP4,TRIM22,TRIM6,UNC93B1"
GO:0045071,negative regulation of viral genome replication,55,12,1.23,10,2.5e-9,2.5e-9,8.042395205348306e-5,"APOBEC3C,IFI16,IFIT1,IFITM1,IFITM3,ISG15,MX1,OAS1,OASL,SLPI,TNF,TRIM6"
GO:0060337,type I interferon signaling pathway,88,14,1.98,12,9.2e-9,9.2e-9,1.9730676237121177e-4,"IFI27,IFI6,IFIT1,IFIT2,IFITM1,IFITM3,IRF9,ISG15,MX1,MX2,OAS1,OAS2,OASL,TRIM6"
GO:0061844,antimicrobial humoral immune response mediated by antimicrobial peptide,63,8,1.41,47,7.9e-5,7.9e-5,1,"CXCL10,CXCL11,CXCL2,CXCL3,DEFB1,KLK5,KLK7,S100A9"
GO:0030593,neutrophil chemotaxis,100,12,2.24,25,1.9e-4,2.4e-6,1,"CD74,CXCL10,CXCL11,CXCL2,CXCL3,EDN2,FCER1G,MDK,MPP1,NCKAP1L,S100A9,SAA1"
GO:1990000,amyloid fibril formation,16,4,0.36,62,3.7e-4,3.7e-4,1,"APOE,CD36,CRYAB,RIPK3"
GO:0006919,activation of cysteine-type endopeptidase activity involved in apoptotic process,82,8,1.84,69,5e-4,5e-4,1,"CASP1,EGLN3,FAM162A,FAS,KHDC1,S100A9,TNF,TNFSF10"
GO:0002922,positive regulation of humoral immune response,18,4,0.4,73,6e-4,6e-4,1,"C3,KLK5,KLK7,TNF"
GO:0019221,cytokine-mediated signaling pathway,748,43,16.79,15,7.6e-4,1.5e-8,1,"ANXA2,CAMK2D,CARD16,CASP1,CD36,CD4,CD74,CXCL10,CXCL11,CXCL2,CXCL3,EDN2,FCER1G,GPR35,IFI27,IFI30,IFI6,IFIT1,IFIT2,IFITM1,IFITM3,IFNL1,IL12A,IL2RG,IL32,IRF9,ISG15,LCN2,MX1,MX2,NDN,OAS1,OAS2,OASL,PSMB9,SAA1,SOX2,SPHK1,TNF,TNFRSF13B,TNFRSF14,TRIM22,TRIM6"
GO:0035455,response to interferon-alpha,20,4,0.45,81,9.1e-4,9.1e-4,1,"IFIT2,IFITM1,IFITM3,MX2"
GO:0070268,cornification,112,9,2.51,82,9.5e-4,9.5e-4,1,"FLG,KLK5,KRT12,KRT16,KRT23,KRT5,KRT80,PI3,TGM1"
GO:2000117,negative regulation of cysteine-type endopeptidase activity,91,8,2.04,84,0.001,0.001,1,"CARD16,CARD18,CDKN2D,CRYAB,IFI16,IFI6,MAGEA3,RPS6KA1"
GO:0051302,regulation of cell division,162,11,3.64,86,0.0011,0.0011,1,"IGF2,KIF20A,KIF23,LBH,MDK,NAP1L2,PLK1,PLK2,PLK3,PTN,RACGAP1"
GO:0097242,amyloid-beta clearance,36,5,0.81,87,0.00118,0.00118,1,"APOE,C3,CD36,PICALM,TNF"
GO:0050731,positive regulation of peptidyl-tyrosine phosphorylation,189,12,4.24,88,0.00119,0.00119,1,"AREG,CD36,CD4,CD74,EFNA1,HBEGF,IFNL1,IGF2,IL12A,TNF,TNFRSF14,UNC119"
GO:0060333,interferon-gamma-mediated signaling pathway,73,7,1.64,89,0.00124,0.00124,1,"CAMK2D,IFI30,IRF9,OAS1,OAS2,OASL,TRIM22"
GO:2001244,positive regulation of intrinsic apoptotic signaling pathway,54,6,1.21,90,0.00128,0.00128,1,"DDIT3,NUPR1,PLEKHF1,RIPK3,RNF183,S100A9"
GO:0033280,response to vitamin D,37,5,0.83,91,0.00134,0.00134,1,"ALPL,CD4,CDKN2D,CXCL10,PTN"
GO:0050766,positive regulation of phagocytosis,69,9,1.55,38,0.00149,2.3e-5,1,"C2,C3,CD36,DOCK2,FCER1G,IL2RG,NCKAP1L,RAP1A,TNF"
GO:0051384,response to glucocorticoid,144,10,3.23,95,0.00154,0.00154,1,"ADM,ALPL,ANXA3,AREG,BCHE,FAM107A,MDK,SCGB1A1,SERPINF1,TNF"
GO:0002863,positive regulation of inflammatory response to antigenic stimulus,11,3,0.25,100,0.00162,0.00162,1,"C3,FCER1G,TNF"
GO:0043525,positive regulation of neuron apoptotic process,57,6,1.28,101,0.0017,0.0017,1,"CTSZ,DDIT3,MAP2K4,MYBL2,NUPR1,TNF"
GO:0071222,cellular response to lipopolysaccharide,201,12,4.51,109,0.002,0.002,1,"CARD16,CASP1,CD36,CMPK2,CXCL10,CXCL11,CXCL2,CXCL3,IL12A,LCN2,LDOC1,TNF"
GO:0050701,interleukin-1 secretion,59,6,1.32,110,0.00203,0.00203,1,"CARD16,CARD18,CASP1,CD36,S100A13,SAA1"
GO:0045087,innate immune response,796,43,17.87,17,0.00223,8.9e-8,1,"APOBEC3B,APOBEC3C,APOE,C2,C3,CAMK2D,CASP1,CFB,COLEC11,CORO1A,DEFB1,FCER1G,IFI16,IFI27,IFI30,IFI6,IFIT1,IFIT2,IFITM1,IFITM3,IFNL1,IL12A,IRF9,ISG15,KRT16,LCN2,MUC21,MUC4,MX1,MX2,OAS1,OAS2,OASL,PSMB9,S100A9,SAA1,SLPI,TNFRSF14,TRIM22,TRIM23,TRIM6,UBD,UNC93B1"
GO:0035456,response to interferon-beta,26,4,0.58,118,0.00253,0.00253,1,"IFI16,IFITM1,IFITM3,TRIM6"
GO:0002026,regulation of the force of heart contraction,26,4,0.58,119,0.00253,0.00253,1,"ADM,CAMK2D,EDN2,MYL4"
GO:0002690,positive regulation of leukocyte chemotaxis,83,7,1.86,120,0.00261,0.00261,1,"CD74,CXCL10,EDN2,IL12A,MDK,NCKAP1L,PTN"
GO:0043123,positive regulation of I-kappaB kinase/NF-kappaB signaling,181,11,4.06,121,0.00265,0.00265,1,"CARD16,CASP1,CD36,CD4,CD74,PLK2,S100A13,TNF,TNFSF10,TRIM22,UBD"
GO:0010838,positive regulation of keratinocyte proliferation,13,3,0.29,126,0.00271,0.00271,1,"AREG,MDK,TGM1"
GO:1900272,negative regulation of long-term synaptic potentiation,13,3,0.29,127,0.00271,0.00271,1,"APOE,FAM107A,PTN"
GO:0060100,"positive regulation of phagocytosis, engulfment",13,3,0.29,128,0.00271,0.00271,1,"C3,CD36,NCKAP1L"
GO:0042742,defense response to bacterium,242,16,5.43,51,0.00278,1.2e-4,1,"ANXA3,CD36,CD4,DEFB1,FCER1G,IL12A,ISG15,KLK5,KLK7,LCN2,LYZL2,PRB3,S100A9,SLPI,TNF,TNFRSF14"
GO:0045745,positive regulation of G protein-coupled receptor signaling pathway,27,4,0.61,134,0.00291,0.00291,1,"ACPP,C3,KLK5,KLK6"
GO:0045785,positive regulation of cell adhesion,389,18,8.73,138,0.00314,0.00314,1,"ADA,ARPC2,CCL28,CD36,CD4,CD74,CORO1A,EGFLAM,FBLN2,IGF2,IL12A,MDK,NCKAP1L,PTN,SAA1,SOX2,TNF,TNFRSF14"
GO:0090022,regulation of neutrophil chemotaxis,28,4,0.63,142,0.00334,0.00334,1,"CD74,MDK,MPP1,NCKAP1L"
GO:0002523,leukocyte migration involved in inflammatory response,14,3,0.31,144,0.0034,0.0034,1,"MDK,PTN,S100A9"
GO:0046596,regulation of viral entry into host cell,29,4,0.65,153,0.00381,0.00381,1,"CD4,CD74,IFITM1,IFITM3"
GO:0002739,regulation of cytokine secretion involved in immune response,15,3,0.34,157,0.00418,0.00418,1,"TNF,TNFRSF14,TRIM6"
GO:1902004,positive regulation of amyloid-beta formation,15,3,0.34,158,0.00418,0.00418,1,"EFNA1,PICALM,TNF"
GO:0051238,sequestering of metal ion,15,3,0.34,159,0.00418,0.00418,1,"FTHL17,LCN2,S100A9"
GO:0002274,myeloid leukocyte activation,629,25,14.12,161,0.00426,0.00426,1,"ACPP,ANXA2,ANXA3,C3,CD33,CD36,CD74,CMTM6,CTSZ,CYSTM1,DHRS2,DOCK2,EDN2,FCER1G,FOLR3,LCN2,NCKAP1L,QPCT,RAP1A,S100A13,S100A9,SLPI,SPHK1,TNF,UBD"
GO:0001782,B cell homeostasis,30,4,0.67,162,0.00432,0.00432,1,"ADA,CD74,NCKAP1L,TNFRSF13B"
GO:0019731,antibacterial humoral response,31,4,0.7,168,0.00487,0.00487,1,"DEFB1,KLK5,KLK7,SLPI"
GO:0000302,response to reactive oxygen species,225,12,5.05,169,0.00499,0.00499,1,"ADA,APOE,AREG,CD36,CRYAB,LCN2,PLK3,RIPK3,SCGB1A1,SPHK1,TNF,UCP1"
GO:0051346,negative regulation of hydrolase activity,443,24,9.94,45,0.00529,6.7e-5,1,"ANGPTL4,ANXA8,C3,CARD16,CARD18,CDKN2D,CPEB2,CRYAB,CST6,GCHFR,IFI16,IFI6,IFIT1,MAGEA3,NCKAP1L,PDE6D,PI3,PICALM,PTN,RPS6KA1,SERPINF1,SLPI,TNF,WFDC2"
GO:0010955,negative regulation of protein processing,32,4,0.72,175,0.00547,0.00547,1,"CARD16,CARD18,CTSZ,MAGEA3"
GO:0002252,immune effector process,1120,58,25.14,7,0.00573,1.8e-9,1,"ACPP,ADA,ANXA2,ANXA3,APOBEC3B,APOBEC3C,ARPC2,C2,C3,CD33,CD36,CD74,CFB,CMTM6,COLEC11,CORO1A,CTSZ,CXCL10,CYSTM1,DOCK2,FCER1G,FOLR3,HFE,IFI16,IFI27,IFI44L,IFI6,IFIT1,IFIT2,IFITM1,IFITM3,IFNL1,IL12A,IRF9,ISG15,KLK5,KLK7,LCN2,MDK,MX1,MX2,NCKAP1L,OAS1,OAS2,OASL,QPCT,RAP1A,RGCC,RIPK3,RTP4,S100A13,S100A9,SLPI,TNF,TNFRSF14,TRIM22,TRIM6,UNC93B1"
GO:0006955,immune response,1855,86,41.64,1,0.00594,3e-11,1,"ACPP,ADA,ANXA2,ANXA3,APOBEC3B,APOBEC3C,APOE,ARPC2,C2,C3,CAMK2D,CASP1,CCL28,CD33,CD36,CD4,CD74,CFB,CMTM6,COLEC11,CORO1A,CTSZ,CXCL10,CXCL11,CXCL2,CXCL3,CYSTM1,DEFB1,DOCK2,ENDOU,FAS,FCER1G,FCGRT,FOLR3,HCST,HFE,IFI16,IFI27,IFI30,IFI44,IFI44L,IFI6,IFIT1,IFIT2,IFITM1,IFITM3,IFNL1,IL12A,IL2RG,IL32,IRF9,ISG15,KLK5,KLK7,KRT16,LCN2,MAP2K4,MDK,MUC21,MUC4,MX1,MX2,NCKAP1L,OAS1,OAS2,OASL,PI3,PPP3R1,PSMB9,QPCT,RAP1A,RGCC,RIPK3,S100A13,S100A9,SAA1,SLPI,TNF,TNFRSF13B,TNFRSF14,TNFSF10,TRIM22,TRIM23,TRIM6,UBD,UNC93B1"
GO:0042129,regulation of T cell proliferation,147,9,3.3,183,0.00599,0.00599,1,"CD4,CORO1A,GPNMB,IGF2,IL12A,NCKAP1L,RIPK3,SCGB1A1,TNFRSF14"
GO:0051092,positive regulation of NF-kappaB transcription factor activity,147,9,3.3,184,0.00599,0.00599,1,"CARD16,CD36,RHEBL1,RIPK3,RNF25,S100A9,SPHK1,TNF,TRIM22"
GO:0002819,regulation of adaptive immune response,148,9,3.32,189,0.00626,0.00626,1,"ADA,C3,CD4,FCER1G,HFE,IL12A,RIPK3,TNF,TNFRSF14"
GO:0032611,interleukin-1 beta production,98,7,2.2,193,0.00654,0.00654,1,"CARD16,CARD18,CASP1,CD33,CD36,IFI16,SPHK1"
GO:0048016,inositol phosphate-mediated signaling,53,5,1.19,194,0.00658,0.00658,1,"CHP2,EDN2,FHL2,PPP3R1,TNF"
GO:1903038,negative regulation of leukocyte cell-cell adhesion,124,8,2.78,199,0.00689,0.00689,1,"CCL28,CD74,GPNMB,HFE,IFNL1,MDK,SCGB1A1,TNFRSF14"
GO:0032652,regulation of interleukin-1 production,99,7,2.22,201,0.00691,0.00691,1,"CARD16,CARD18,CASP1,CD33,IFI16,SAA1,SPHK1"
GO:0000079,regulation of cyclin-dependent protein serine/threonine kinase activity,99,7,2.22,202,0.00691,0.00691,1,"CCNB3,CDKN2D,CDKN3,CKS1B,GADD45A,PLK1,RGCC"
GO:0032091,negative regulation of protein binding,99,7,2.22,203,0.00691,0.00691,1,"CARD16,CARD18,CTSZ,HFE,IFIT1,IFIT2,SLPI"
GO:0090307,mitotic spindle assembly,54,5,1.21,206,0.00713,0.00713,1,"KIF23,KIFC1,MYBL2,PLK1,RACGAP1"
GO:0072574,hepatocyte proliferation,18,3,0.4,207,0.00713,0.00713,1,"MDK,PTN,RPS6KA1"
GO:0061081,positive regulation of myeloid leukocyte cytokine production involved in immune response,18,3,0.4,208,0.00713,0.00713,1,"CD36,CD74,FCER1G"
GO:0070233,negative regulation of T cell apoptotic process,18,3,0.4,209,0.00713,0.00713,1,"ADA,EFNA1,TSC22D3"
GO:0032462,regulation of protein homooligomerization,18,3,0.4,210,0.00713,0.00713,1,"APOE,BIK,CRYAB"
GO:0045596,negative regulation of cell differentiation,693,26,15.56,213,0.00749,0.00749,1,"APOE,AREG,BCL11A,CD74,CHADL,CTSZ,CXCL10,DDIT3,EFNA1,FGF13,FUOM,HOPX,IFNL1,KLK8,LBH,MDK,MESP1,PLK2,PTN,SOX2,TACSTD2,TMEM176A,TMEM176B,TNF,TRIM6,WDR61"
GO:0002683,negative regulation of immune system process,400,17,8.98,230,0.00919,0.00919,1,"ADA,CCL28,CD74,FCER1G,GPNMB,HFE,IFI16,IFNL1,MDK,SCGB1A1,TMEM176A,TMEM176B,TNF,TNFRSF13B,TNFRSF14,TSC22D3,WDR61"
GO:0043029,T cell homeostasis,37,4,0.83,231,0.0092,0.0092,1,"CORO1A,NCKAP1L,RIPK3,TSC22D3"
GO:1902904,negative regulation of supramolecular fiber organization,131,8,2.94,233,0.00947,0.00947,1,"APOE,CHADL,CORO1A,CRYAB,FGF13,PFN2,TACSTD2,TRIM54"
GO:0019886,antigen processing and presentation of exogenous peptide antigen via MHC class II,81,6,1.82,234,0.00971,0.00971,1,"CD74,CTSF,FCER1G,IFI30,KIF23,RACGAP1"
GO:0042127,regulation of cell population proliferation,1598,57,35.87,60,0.0098,2.9e-4,1,"ADA,ADM,ANXA2,APOE,AREG,AVPR2,BCHE,BEX4,CD33,CD4,CD74,CDKN2D,CDKN3,CHP2,CORO1A,CRIP2,CTSZ,CXCL10,CXCL11,DHRS2,EDN2,EGLN3,EPCAM,FBXO2,GPNMB,HBEGF,IFITM1,IFNL1,IGF2,IL12A,LBH,LDOC1,LGR5,MDK,NCKAP1L,NDN,NUPR1,OSGIN1,PDE1A,PDF,PTN,RAB25,RERG,RGCC,RIPK3,S100A13,SAT1,SCGB1A1,SCGB3A1,SERPINF1,SOX2,SPHK1,TACSTD2,TGM1,TNF,TNFRSF13B,TNFRSF14"
GO:0002822,regulation of adaptive immune response based on somatic recombination of immune receptors built from immunoglobulin superfamily domains,133,8,2.99,237,0.01033,0.01033,1,"ADA,C3,CD4,FCER1G,HFE,IL12A,RIPK3,TNF"
GO:0032609,interferon-gamma production,107,7,2.4,238,0.01041,0.01041,1,"AVPR2,IFNL1,IL12A,ISG15,RIPK3,SCGB1A1,TNF"
GO:0050868,negative regulation of T cell activation,107,7,2.4,239,0.01041,0.01041,1,"CD74,GPNMB,HFE,IFNL1,MDK,SCGB1A1,TNFRSF14"
GO:0043154,negative regulation of cysteine-type endopeptidase activity involved in apoptotic process,83,6,1.86,241,0.01089,0.01089,1,"CARD16,CDKN2D,CRYAB,IFI6,MAGEA3,RPS6KA1"
GO:0042454,ribonucleoside catabolic process,21,3,0.47,244,0.01105,0.01105,1,"ADA,APOBEC3B,APOBEC3C"
GO:0031099,regeneration,191,10,4.29,246,0.01123,0.01123,1,"ADM,ANXA3,CPQ,HFE,KLK6,KLK8,MDK,PTN,RAP1A,SOX2"
GO:0010660,regulation of muscle cell apoptotic process,84,6,1.89,250,0.01151,0.01151,1,"CAMK2D,IL12A,MAP2K4,MDK,NUPR1,PDE1A"
GO:0051781,positive regulation of cell division,84,6,1.89,251,0.01151,0.01151,1,"IGF2,KIF23,LBH,MDK,PTN,RACGAP1"
GO:0051241,negative regulation of multicellular organismal process,1231,40,27.63,253,0.01166,0.01166,1,"ADA,ADM,ANXA2,APOE,AREG,AVPR2,BCL11A,CARD16,CARD18,CD33,CD74,CHADL,CTSZ,CXCL10,DDIT3,EFNA1,FGF13,FUOM,GPNMB,GPR35,HFE,IFNL1,IL12A,ISG15,KLK8,MDK,MESP1,NCKAP1L,PFN2,PLK2,PTN,RGCC,SCGB1A1,SERPINF1,SOX2,TACSTD2,TMEM176A,TMEM176B,TNF,WDR61"
GO:2000008,regulation of protein localization to cell surface,40,4,0.9,256,0.01208,0.01208,1,"FCER1G,HFE,PICALM,TNF"
GO:0007613,memory,111,7,2.49,257,0.01257,0.01257,1,"APOE,FGF13,KLK8,MDK,PLK2,PTN,SERPINF1"
GO:0090023,positive regulation of neutrophil chemotaxis,22,3,0.49,258,0.01259,0.01259,1,"CD74,MDK,NCKAP1L"
GO:0032069,regulation of nuclease activity,22,3,0.49,259,0.01259,0.01259,1,"OAS1,OAS2,OASL"
GO:0033173,calcineurin-NFAT signaling cascade,41,4,0.92,263,0.01315,0.01315,1,"CHP2,FHL2,PPP3R1,TNF"
GO:0097028,dendritic cell differentiation,41,4,0.92,264,0.01315,0.01315,1,"DHRS2,TMEM176A,TMEM176B,UBD"
GO:0032651,regulation of interleukin-1 beta production,87,6,1.95,269,0.01352,0.01352,1,"CARD16,CARD18,CASP1,CD33,IFI16,SPHK1"
GO:0043299,leukocyte degranulation,519,20,11.65,270,0.0137,0.0137,1,"ACPP,ANXA2,ANXA3,C3,CD33,CD36,CMTM6,CORO1A,CTSZ,CYSTM1,DOCK2,FCER1G,FOLR3,LCN2,NCKAP1L,QPCT,RAP1A,S100A13,S100A9,SLPI"
GO:0051250,negative regulation of lymphocyte activation,140,8,3.14,271,0.01377,0.01377,1,"CD74,GPNMB,HFE,IFNL1,MDK,SCGB1A1,TNFRSF13B,TNFRSF14"
GO:0010460,positive regulation of heart rate,23,3,0.52,275,0.01424,0.01424,1,"ADA,ADM,EDN2"
GO:0032373,positive regulation of sterol transport,23,3,0.52,276,0.01424,0.01424,1,"ANXA2,APOE,PON1"
GO:0032376,positive regulation of cholesterol transport,23,3,0.52,277,0.01424,0.01424,1,"ANXA2,APOE,PON1"
GO:0010657,muscle cell apoptotic process,88,6,1.98,278,0.01425,0.01425,1,"CAMK2D,IL12A,MAP2K4,MDK,NUPR1,PDE1A"
GO:0002824,positive regulation of adaptive immune response based on somatic recombination of immune receptors built from immunoglobulin superfamily domains,88,6,1.98,279,0.01425,0.01425,1,"ADA,C3,CD4,FCER1G,IL12A,TNF"
GO:0032465,regulation of cytokinesis,88,6,1.98,280,0.01425,0.01425,1,"KIF20A,KIF23,PLK1,PLK2,PLK3,RACGAP1"
GO:0050850,positive regulation of calcium-mediated signaling,42,4,0.94,281,0.01429,0.01429,1,"ADA,CD4,CHP2,TNF"
GO:0030866,cortical actin cytoskeleton organization,42,4,0.94,282,0.01429,0.01429,1,"KIF23,NCKAP1L,RACGAP1,TNF"
GO:0006875,cellular metal ion homeostasis,556,21,12.48,284,0.01439,0.01439,1,"ADM,ANXA2,APOE,ATP12A,CAMK2D,CCL28,CD36,CD4,CORO1A,CP,CXCL10,CXCL11,DDIT3,EDN2,FTHL17,GPR35,HFE,LCN2,MT1E,S100A9,SAA1"
GO:0022407,regulation of cell-cell adhesion,387,20,8.69,68,0.01449,5e-4,1,"ADA,CCL28,CD4,CD74,CORO1A,EPCAM,FXYD5,GPNMB,HFE,IFNL1,IGF2,IL12A,MDK,MUC21,NCKAP1L,RGCC,SCGB1A1,SOX2,TNF,TNFRSF14"
GO:0052548,regulation of endopeptidase activity,406,27,9.11,21,0.01472,5.3e-7,1,"ANXA8,C3,CARD16,CARD18,CASP1,CDKN2D,CRYAB,CST6,EFNA1,EGLN3,FAM162A,FAS,IFI16,IFI6,KHDC1,MAGEA3,PI3,PICALM,PSMB9,RPS6KA1,S100A9,SERPINF1,SLPI,SOX2,TNF,TNFSF10,WFDC2"
GO:0055065,metal ion homeostasis,627,23,14.07,285,0.01473,0.01473,1,"ADM,ANXA2,APOE,ATP12A,AVPR2,CAMK2D,CCL28,CD36,CD4,CORO1A,CP,CXCL10,CXCL11,DDIT3,EDN2,FTHL17,GPR35,HFE,LCN2,MT1E,PICALM,S100A9,SAA1"
GO:0030162,regulation of proteolysis,693,36,15.56,26,0.01492,2.6e-6,1,"ANXA2,ANXA8,APOE,C3,CARD16,CARD18,CASP1,CDKN2D,CRYAB,CST6,CTSZ,EFNA1,EGLN3,FAM162A,FAS,HFE,IFI16,IFI6,KHDC1,MAGEA3,NUPR1,PI3,PICALM,PLK1,PLK2,PLK3,PSMB9,RPS6KA1,S100A9,SERPINF1,SLPI,SOX2,TNF,TNFSF10,WFDC2,ZFAND2A"
GO:0050830,defense response to Gram-positive bacterium,90,6,2.02,289,0.01578,0.01578,1,"CD36,DEFB1,IL12A,LYZL2,TNF,TNFRSF14"
GO:0071624,positive regulation of granulocyte chemotaxis,24,3,0.54,290,0.01601,0.01601,1,"CD74,MDK,NCKAP1L"
GO:0000070,mitotic sister chromatid segregation,144,8,3.23,291,0.01608,0.01608,1,"CDCA8,KIF23,KIFC1,KNSTRN,NUF2,PLK1,RACGAP1,TACC3"
GO:2000134,negative regulation of G1/S transition of mitotic cell cycle,117,7,2.63,292,0.0164,0.0164,1,"CDKN2D,FAM107A,GADD45A,GPNMB,PLK2,PLK3,RGCC"
GO:0097720,calcineurin-mediated signaling,44,4,0.99,295,0.01673,0.01673,1,"CHP2,FHL2,PPP3R1,TNF"
GO:0010811,positive regulation of cell-substrate adhesion,118,7,2.65,296,0.01711,0.01711,1,"ARPC2,CCL28,CD36,EGFLAM,FBLN2,MDK,PTN"
GO:0019915,lipid storage,67,5,1.5,297,0.01721,0.01721,1,"APOE,C3,CD36,PLIN2,TNF"
GO:0002443,leukocyte mediated immunity,744,26,16.7,298,0.01736,0.01736,1,"ACPP,ANXA2,ANXA3,C2,C3,CD33,CD36,CD74,CMTM6,CORO1A,CTSZ,CYSTM1,DOCK2,FCER1G,FOLR3,HFE,IL12A,LCN2,NCKAP1L,QPCT,RAP1A,RIPK3,S100A13,S100A9,SLPI,TNF"
GO:0016049,cell growth,464,18,10.42,301,0.01769,0.01769,1,"APOE,BCL11A,CAMK2D,CDKN2D,CRABP2,CRYAB,FAM107A,FBP1,FGF13,HBEGF,MAP2K4,NDN,OSGIN1,RERG,RPS6KA1,S100A9,SCGB3A1,SPHK1"
GO:0010996,response to auditory stimulus,25,3,0.56,302,0.01789,0.01789,1,"CXCL10,MDK,PTN"
GO:1905809,negative regulation of synapse organization,25,3,0.56,303,0.01789,0.01789,1,"APOE,EFNA1,PTN"
GO:1900120,regulation of receptor binding,25,3,0.56,304,0.01789,0.01789,1,"ANXA2,HFE,LDOC1"
GO:0045662,negative regulation of myoblast differentiation,25,3,0.56,305,0.01789,0.01789,1,"CXCL10,DDIT3,TNF"
GO:0019722,calcium-mediated signaling,206,10,4.62,306,0.01819,0.01819,1,"ADA,CAMK2D,CD4,CHP2,DEFB1,EDN2,FHL2,PPP3R1,SPHK1,TNF"
GO:0002821,positive regulation of adaptive immune response,93,6,2.09,307,0.01828,0.01828,1,"ADA,C3,CD4,FCER1G,IL12A,TNF"
GO:0010951,negative regulation of endopeptidase activity,241,16,5.41,50,0.01839,1.1e-4,1,"ANXA8,C3,CARD16,CARD18,CDKN2D,CRYAB,CST6,IFI16,IFI6,MAGEA3,PI3,PICALM,RPS6KA1,SERPINF1,SLPI,WFDC2"
GO:0001558,regulation of cell growth,399,16,8.96,308,0.01861,0.01861,1,"APOE,BCL11A,CAMK2D,CDKN2D,CRABP2,CRYAB,FAM107A,FBP1,FGF13,HBEGF,OSGIN1,RERG,RPS6KA1,S100A9,SCGB3A1,SPHK1"
GO:0072422,signal transduction involved in DNA damage checkpoint,69,5,1.55,309,0.01932,0.01932,1,"GADD45A,PLK1,PLK2,PLK3,RGCC"
GO:0072401,signal transduction involved in DNA integrity checkpoint,69,5,1.55,310,0.01932,0.01932,1,"GADD45A,PLK1,PLK2,PLK3,RGCC"
GO:0051651,maintenance of location in cell,208,10,4.67,312,0.01932,0.01932,1,"APOE,CAMK2D,CD4,CORO1A,CXCL10,CXCL11,DDIT3,FTHL17,LCN2,S100A9"
GO:0031345,negative regulation of cell projection organization,179,9,4.02,315,0.01993,0.01993,1,"APOE,BCL11A,CTSZ,EFNA1,FGF13,KLK8,PFN2,PLK2,TACSTD2"
GO:2000035,regulation of stem cell division,10,2,0.22,316,0.02007,0.02007,1,"LBH,NAP1L2"
GO:0035376,sterol import,10,2,0.22,317,0.02007,0.02007,1,"CD36,STARD5"
GO:2000425,regulation of apoptotic cell clearance,10,2,0.22,318,0.02007,0.02007,1,"C2,C3"
GO:1900426,positive regulation of defense response to bacterium,10,2,0.22,319,0.02007,0.02007,1,"KLK5,KLK7"
GO:1900122,positive regulation of receptor binding,10,2,0.22,320,0.02007,0.02007,1,"ANXA2,HFE"
GO:2001214,positive regulation of vasculogenesis,10,2,0.22,321,0.02007,0.02007,1,"ADM,RAP1A"
GO:0045657,positive regulation of monocyte differentiation,10,2,0.22,322,0.02007,0.02007,1,"CD4,CD74"
GO:2000644,regulation of receptor catabolic process,10,2,0.22,323,0.02007,0.02007,1,"ANXA2,APOE"
GO:0051409,response to nitrosative stress,10,2,0.22,324,0.02007,0.02007,1,"DDIT3,DUSP6"
GO:0051255,spindle midzone assembly,10,2,0.22,325,0.02007,0.02007,1,"KIF23,RACGAP1"
GO:0051231,spindle elongation,10,2,0.22,326,0.02007,0.02007,1,"KIF23,RACGAP1"
GO:1902237,positive regulation of endoplasmic reticulum stress-induced intrinsic apoptotic signaling pathway,10,2,0.22,327,0.02007,0.02007,1,"DDIT3,RNF183"
GO:0070508,cholesterol import,10,2,0.22,328,0.02007,0.02007,1,"CD36,STARD5"
GO:0032649,regulation of interferon-gamma production,95,6,2.13,329,0.02009,0.02009,1,"IFNL1,IL12A,ISG15,RIPK3,SCGB1A1,TNF"
GO:0050848,regulation of calcium-mediated signaling,95,6,2.13,330,0.02009,0.02009,1,"ADA,CAMK2D,CD4,CHP2,FHL2,TNF"
GO:0098869,cellular oxidant detoxification,95,6,2.13,331,0.02009,0.02009,1,"APOE,CD36,GPX3,HBE1,S100A9,TNF"
GO:0043281,regulation of cysteine-type endopeptidase activity involved in apoptotic process,206,15,4.62,44,0.02014,6.7e-5,1,"CARD16,CASP1,CDKN2D,CRYAB,EGLN3,FAM162A,FAS,IFI6,KHDC1,MAGEA3,RPS6KA1,S100A9,SOX2,TNF,TNFSF10"
GO:0051259,protein complex oligomerization,527,22,11.83,155,0.02021,0.00406,1,"ACPP,ANGPTL4,ANXA2,APOE,BIK,CAMK2D,CD74,CLDN3,CRYAB,DDIT3,FBP1,FCER1G,GCHFR,GPX3,HBE1,KCNS3,LCN2,MARCKS,OAT,RIPK3,TRIM22,TRIM6"
GO:0072395,signal transduction involved in cell cycle checkpoint,70,5,1.57,333,0.02043,0.02043,1,"GADD45A,PLK1,PLK2,PLK3,RGCC"
GO:1903039,positive regulation of leukocyte cell-cell adhesion,210,10,4.71,336,0.02049,0.02049,1,"ADA,CD4,CD74,CORO1A,IGF2,IL12A,MDK,NCKAP1L,TNF,TNFRSF14"
GO:0043312,neutrophil degranulation,472,18,10.59,337,0.02061,0.02061,1,"ACPP,ANXA2,ANXA3,C3,CD33,CD36,CMTM6,CTSZ,CYSTM1,DOCK2,FCER1G,FOLR3,LCN2,NCKAP1L,QPCT,RAP1A,S100A9,SLPI"
GO:0030865,cortical cytoskeleton organization,47,4,1.05,340,0.02087,0.02087,1,"KIF23,NCKAP1L,RACGAP1,TNF"
GO:1902807,negative regulation of cell cycle G1/S phase transition,123,7,2.76,342,0.02099,0.02099,1,"CDKN2D,FAM107A,GADD45A,GPNMB,PLK2,PLK3,RGCC"
GO:0034446,substrate adhesion-dependent cell spreading,96,6,2.15,343,0.02103,0.02103,1,"ARPC2,EFNA1,EGFLAM,LAMB3,MDK,TACSTD2"
GO:0000281,mitotic cytokinesis,71,5,1.59,345,0.02159,0.02159,1,"KIF20A,KIF23,PLK1,RACGAP1,UNC119"
GO:0009119,ribonucleoside metabolic process,71,5,1.59,346,0.02159,0.02159,1,"ACPP,ADA,APOBEC3B,APOBEC3C,MPP1"
GO:0002283,neutrophil activation involved in immune response,475,18,10.66,348,0.02179,0.02179,1,"ACPP,ANXA2,ANXA3,C3,CD33,CD36,CMTM6,CTSZ,CYSTM1,DOCK2,FCER1G,FOLR3,LCN2,NCKAP1L,QPCT,RAP1A,S100A9,SLPI"
GO:0040007,growth,944,31,21.19,349,0.02191,0.02191,1,"ADM,ANXA2,APOE,AREG,BCL11A,CAMK2D,CDKN2D,CPQ,CRABP2,CRYAB,DUSP6,FAM107A,FBP1,FGF13,HBEGF,IGF2,KLK6,MAP2K4,MDK,MESP1,MT1E,NDN,OSGIN1,PTN,RERG,RPS6KA1,S100A9,SCGB3A1,SOX2,SPHK1,UBE2E3"
GO:1902624,positive regulation of neutrophil migration,27,3,0.61,350,0.02202,0.02202,1,"CD74,MDK,NCKAP1L"
GO:0002691,regulation of cellular extravasation,27,3,0.61,351,0.02202,0.02202,1,"CCL28,MDK,RIPK3"
GO:0022409,positive regulation of cell-cell adhesion,244,11,5.48,352,0.02229,0.02229,1,"ADA,CD4,CD74,CORO1A,IGF2,IL12A,MDK,NCKAP1L,SOX2,TNF,TNFRSF14"
GO:0050671,positive regulation of lymphocyte proliferation,125,7,2.81,353,0.0227,0.0227,1,"ADA,CD4,CD74,CORO1A,IGF2,IL12A,NCKAP1L"
GO:0006956,complement activation,72,5,1.62,354,0.02279,0.02279,1,"C2,C3,CFB,COLEC11,RGCC"
GO:0051270,regulation of cellular component movement,1016,38,22.81,93,0.02341,0.0014,1,"ADA,ANXA3,APOE,ARMC4,BEX4,CAMK2D,CCL28,CD74,CORO1A,CXCL10,DEFB1,EDN2,EFNA1,EPCAM,FAM107A,FGF13,GPNMB,HBEGF,IFITM1,IL12A,KRT16,MDK,MPP1,NCKAP1L,OSGIN1,PFN2,PLK2,PTN,RAB25,RGCC,RIPK3,RND3,SERPINF1,SPHK1,SRGAP2B,TACSTD2,TNF,TNFRSF14"
GO:0032946,positive regulation of mononuclear cell proliferation,126,7,2.83,357,0.02359,0.02359,1,"ADA,CD4,CD74,CORO1A,IGF2,IL12A,NCKAP1L"
GO:0031589,cell-substrate adhesion,344,14,7.72,359,0.02387,0.02387,1,"ARPC2,CCL28,CD36,CORO1A,EFNA1,EGFLAM,FAM107A,FBLN2,ITGB6,LAMB3,MDK,MUC4,PTN,TACSTD2"
GO:0042246,tissue regeneration,73,5,1.64,362,0.02403,0.02403,1,"CPQ,KLK6,MDK,PTN,SOX2"
GO:0051291,protein heterooligomerization,99,6,2.22,363,0.02406,0.02406,1,"ANXA2,CD74,CLDN3,GCHFR,HBE1,RIPK3"
GO:0045060,negative thymic T cell selection,11,2,0.25,364,0.02417,0.02417,1,"CD74,DOCK2"
GO:0002864,regulation of acute inflammatory response to antigenic stimulus,11,2,0.25,365,0.02417,0.02417,1,"C3,FCER1G"
GO:0072537,fibroblast activation,11,2,0.25,366,0.02417,0.02417,1,"RGCC,RPS6KA1"
GO:1905245,regulation of aspartic-type peptidase activity,11,2,0.25,367,0.02417,0.02417,1,"EFNA1,PICALM"
GO:2000121,regulation of removal of superoxide radicals,11,2,0.25,368,0.02417,0.02417,1,"CD36,TNF"
GO:2001198,regulation of dendritic cell differentiation,11,2,0.25,369,0.02417,0.02417,1,"TMEM176A,TMEM176B"
GO:0000185,activation of MAPKKK activity,11,2,0.25,370,0.02417,0.02417,1,"GADD45A,TNF"
GO:0090148,membrane fission,11,2,0.25,371,0.02417,0.02417,1,"MX1,MX2"
GO:0046886,positive regulation of hormone biosynthetic process,11,2,0.25,372,0.02417,0.02417,1,"ADM,TNF"
GO:0001773,myeloid dendritic cell activation,28,3,0.63,373,0.02426,0.02426,1,"DHRS2,DOCK2,UBD"
GO:0010800,positive regulation of peptidyl-threonine phosphorylation,28,3,0.63,374,0.02426,0.02426,1,"PLK1,SPHK1,TRIM6"
GO:0034390,smooth muscle cell apoptotic process,28,3,0.63,375,0.02426,0.02426,1,"IL12A,MAP2K4,PDE1A"
GO:0034391,regulation of smooth muscle cell apoptotic process,28,3,0.63,376,0.02426,0.02426,1,"IL12A,MAP2K4,PDE1A"
GO:0008608,attachment of spindle microtubules to kinetochore,28,3,0.63,377,0.02426,0.02426,1,"KNSTRN,NUF2,RACGAP1"
GO:1904994,regulation of leukocyte adhesion to vascular endothelial cell,28,3,0.63,378,0.02426,0.02426,1,"CCL28,MDK,TNF"
GO:0031338,regulation of vesicle fusion,28,3,0.63,379,0.02426,0.02426,1,"ANXA2,CORO1A,SPHK1"
GO:0090200,positive regulation of release of cytochrome c from mitochondria,28,3,0.63,380,0.02426,0.02426,1,"BIK,FAM162A,TNFSF10"
GO:0022408,negative regulation of cell-cell adhesion,174,12,3.91,71,0.02445,5.7e-4,1,"CCL28,CD74,EPCAM,FXYD5,GPNMB,HFE,IFNL1,MDK,MUC21,RGCC,SCGB1A1,TNFRSF14"
GO:0003158,endothelium development,127,7,2.85,381,0.02451,0.02451,1,"ANXA2,CXCL10,GJA4,MESP1,PTN,RAP1A,TNF"
GO:0098754,detoxification,127,7,2.85,382,0.02451,0.02451,1,"APOE,CD36,GPX3,HBE1,MT1E,S100A9,TNF"
GO:0055076,transition metal ion homeostasis,127,7,2.85,383,0.02451,0.02451,1,"CP,FTHL17,HFE,LCN2,MT1E,PICALM,S100A9"
GO:0006898,receptor-mediated endocytosis,248,11,5.57,386,0.02475,0.02475,1,"ADM,ANXA2,APOE,C3,CD36,COLEC11,FCER1G,HFE,PICALM,SAA1,UNC119"
GO:0070482,response to oxygen levels,380,15,8.53,387,0.02517,0.02517,1,"ADA,ADM,ANGPTL4,CA9,CARD16,CLDN3,CPEB2,CRYAB,EGLN3,FAM162A,FAS,PLK3,PSMB9,PTN,RGCC"
GO:0042119,neutrophil activation,483,18,10.84,388,0.02522,0.02522,1,"ACPP,ANXA2,ANXA3,C3,CD33,CD36,CMTM6,CTSZ,CYSTM1,DOCK2,FCER1G,FOLR3,LCN2,NCKAP1L,QPCT,RAP1A,S100A9,SLPI"
GO:0050890,cognition,281,12,6.31,390,0.02534,0.02534,1,"APOE,BCHE,CBR3,FAM107A,FGF13,KLK8,MDK,PICALM,PLK2,PTN,SERPINF1,TNF"
GO:0001666,response to hypoxia,347,14,7.79,391,0.02547,0.02547,1,"ADA,ADM,ANGPTL4,CA9,CARD16,CLDN3,CPEB2,CRYAB,EGLN3,FAM162A,PLK3,PSMB9,PTN,RGCC"
