GO.ID,Term,Annotated,Significant,Expected,Rank in p.value_classic,p.value_elim,p.value_classic,padj_BY_elim,genes
GO:0016114,terpenoid biosynthetic process,15,2,0.35,303,0.04585,0.04585,1,"CRABP2,RBP1"
GO:1903019,negative regulation of glycoprotein metabolic process,15,2,0.35,304,0.04585,0.04585,1,"ACOT8,HBEGF"
GO:0006744,ubiquinone biosynthetic process,15,2,0.35,305,0.04585,0.04585,1,"COQ3,COQ5"
GO:0046851,negative regulation of bone remodeling,15,2,0.35,306,0.04585,0.04585,1,"IL6,TNFRSF11B"
GO:0050711,negative regulation of interleukin-1 secretion,15,2,0.35,307,0.04585,0.04585,1,"IL1R2,ZC3H12A"
GO:0099116,tRNA 5'-end processing,15,2,0.35,308,0.04585,0.04585,1,"HSD17B10,RPP40"
GO:0071850,mitotic cell cycle arrest,15,2,0.35,309,0.04585,0.04585,1,"CDKN1A,RGCC"
GO:0072524,pyridine-containing compound metabolic process,35,3,0.81,310,0.04646,0.04646,1,"NNMT,PNP,PSAT1"
GO:0051931,regulation of sensory perception,35,3,0.81,311,0.04646,0.04646,1,"CCK,FABP5,TMEM100"
GO:0060428,lung epithelium development,35,3,0.81,312,0.04646,0.04646,1,"ERRFI1,SPDEF,STRA6"
GO:0006882,cellular zinc ion homeostasis,35,3,0.81,313,0.04646,0.04646,1,"MT1X,MT2A,S100A9"
